post_id,date,subreddit,upvotes,comm,ratio,title
t3_ro9arc,1640436795,deeplearning,2,1,0.75,Looking for multiple Image illustration generator
t3_rnovk0,1640360912,deeplearning,25,1,0.93,[R] OpenAI Releases GLIDE: A Scaled-Down Text-to-Image Model That Rivals DALL-E Performance
t3_ro5h2m,1640419300,deeplearning,0,1,0.5,How transfer learning works on images it was not trained on
t3_ro4h4v,1640415019,deeplearning,0,8,0.5,Need some guidance for my first project
t3_rnxvhn,1640389997,deeplearning,2,0,0.75,Shape recognition with segmentation and classification
t3_rnrtag,1640370062,deeplearning,4,1,0.75,Small trained transformer?
t3_rnrlkz,1640369372,deeplearning,2,4,0.63,Phish: A Novel Hyper-Optimizable Activation Function
t3_rngoo2,1640329685,deeplearning,17,0,0.78,Artificial Vision with Neocognitron by Kunihiko Fukushima (the father of convolutional neural networks)
t3_rnozf6,1640361266,deeplearning,2,0,1,Binary Passage Retrieval in Weaviate
t3_rns4t9,1640371092,deeplearning,1,0,0.6,Does Yolov4 runs on Mac m1?
t3_rnmwns,1640354418,deeplearning,1,0,0.6,Wonders Of Nature - AI images generated by GauGAN2
t3_rnm0dq,1640351306,deeplearning,1,0,0.67,"Finetuning ResNet50 on ""Totally Looks Like"" Dataset"
t3_rmzqfu,1640278044,deeplearning,16,10,0.94,PyTorch or Tensorflow for production
t3_rmyf3s,1640274352,deeplearning,7,0,1,[R] Advancing Deep Learning With Collective Intelligence: Google Brain Surveys Recent Developments
t3_rn3orx,1640288862,deeplearning,0,1,0.43,Cool little infographic on how AI/ML could be applied at Christmas. Any other ideas?
t3_rmnscr,1640235961,deeplearning,6,2,0.88,How to Research Deep Learning
t3_rmqjoo,1640246001,deeplearning,3,3,1,Convert a SMILES dataset to graph
t3_rmytn9,1640275498,deeplearning,0,1,0.2,Introduce a site or YouTube channel
t3_rmsh5b,1640253947,deeplearning,1,3,0.67,Oddly getting a dramatic accuracy difference for the same model when it is deployed on MATLAB compared to TensorFlow &amp; Keras?
t3_rmhybo,1640216397,deeplearning,4,3,0.75,What pytorch model can I use to classify a json array of objects?
t3_rmdg2h,1640203297,deeplearning,5,5,0.86,Best DN architecture for multivariable time series prediction
t3_rm83lb,1640188557,deeplearning,8,0,1,"[R] Facebook AI &amp; JHU’s MaskFeat Method Surpasses Kaiming He’s MAE, Sets New SOTA in Video Action Recognition"
t3_rmeqqm,1640206996,deeplearning,3,0,1,How to process unordered features
