post_id,date,subreddit,upvotes,comm,ratio,title
t3_rtw91q,1641081614,Python,10,19,1,Sunday Daily Thread: What's everyone working on this week?
t3_rvfybl,1641254419,Python,1,0,1,Tuesday Daily Thread: Advanced questions
t3_rvahuo,1641239971,Python,76,62,0.92,How did you learn python?
t3_ruytfm,1641206185,Python,352,61,0.87,EMOJILANG: A programming language where you can code using emojis🗿
t3_rv8i2y,1641234803,Python,66,9,0.94,I created a tool to detect broken __slots__ in Python libraries
t3_rv8p8m,1641235323,Python,28,12,0.85,Create Your First Reddit Bot with Python and Heroku
t3_rv5ybi,1641228217,Python,16,0,0.78,Secrets of MicroPython: How to read a knob
t3_rvbcyz,1641242197,Python,5,0,0.86,Project Althaia - looking for performance/accuracy feedback on my shallow fork of marshmallow
t3_rv0t98,1641213490,Python,21,5,0.86,Suggestions on how to improve this subreddit
t3_rv9k9p,1641237532,Python,5,3,0.63,"I compared RNNs, LSTMs, and GRUs performance on the MNIST Digits Dataset"
t3_ruhi7p,1641152479,Python,332,44,0.97,Pyspark now provides a native Pandas API
t3_rv8wuf,1641235883,Python,3,0,0.72,A history of the attrs library
t3_rvdgv1,1641247729,Python,2,0,0.63,Setting up Alembic with SQLAlchemy
t3_ruwbyl,1641196112,Python,27,23,0.89,Starlite: An Opinionated ASGI Framework
t3_ruligu,1641163169,Python,150,21,0.94,My TUI library pytermgui just hit its first stable release!
t3_rv1wil,1641217061,Python,10,7,0.79,Easily run code before and after a given method with supercharge
t3_rvhx6a,1641259886,Python,1,0,1,How do you deal with analysis paralysis in programming?
t3_rvhdar,1641258370,Python,0,3,0.5,How do i create a stock program in python
t3_rvcb8v,1641244696,Python,1,1,0.57,Make Tic Tac Toe in PYTHON and PYGAME! (14 MINS)
t3_rv8ril,1641235492,Python,4,0,0.83,Calculator by words
t3_ruz4q1,1641207442,Python,9,4,0.81,HPC Rocket - A tool to run Slurm jobs from CI pipelines
t3_rutic6,1641186012,Python,22,1,0.89,I made a tutorial for deployment with Python and Heroku.
t3_rvb1bh,1641241367,Python,0,0,0.5,Build your own Low-Code Business Applications with SpiffWorkflow
t3_rv3a2r,1641221190,Python,2,0,0.75,Variables in Python - Lecture 2 | Python Course for Beginners
t3_ruz4nq,1641207434,Python,4,2,1,The HEX Function is a bit mean...
t3_rulsee,1641163884,Python,38,4,0.91,Sending my university schedule to Google Calendar
t3_rv7y8t,1641233397,Python,1,0,0.6,Record Chess Moves with Python and Webcam
t3_rv069b,1641211314,Python,2,1,0.63,Full-length tutorial on deploying Flask app on AWS with Docker + RDS + Secrets Manager
t3_rugct0,1641149473,Python,63,31,0.87,"If you would implement the Singleton pattern, which approach would you use? Metaclass, Decorator, Classic Approach?"
t3_ruxp6q,1641201738,Python,4,0,1,An introduction to data oriented programming
t3_rv3gfm,1641221696,Python,1,0,1,"Check out the Python on Microcontrollers newsletter, out every Tuesday"
t3_ru8rfe,1641126840,Python,111,15,0.87,Task management tool written in Python that does more than taskwarrior
t3_rulp1f,1641163644,Python,16,14,0.88,Best way to validate active subscription to software?
t3_ruw2w9,1641195117,Python,2,9,0.55,I made a temperature conversion tool with a fail-safe. Here's the code:
t3_ru7a1d,1641120457,Python,117,54,0.87,Simple Random Password Generator
t3_rv0j3f,1641212563,Python,1,0,0.6,✔ 2022 Python Programming (Beginner To Advanced)
t3_runc8j,1641168012,Python,6,10,0.75,Monday Daily Thread: Project ideas!
t3_ruovw2,1641172316,Python,3,5,0.71,Price Tracker
t3_rtrduz,1641067921,Python,443,50,0.96,Finally a proper email sender
t3_ruwgsz,1641196667,Python,0,15,0.25,Run Python files with an application
t3_ru8ez1,1641125449,Python,17,8,0.6,The Ultimate Guide to Comments and Docstrings in Python | Everything you need to know
t3_ru0v3j,1641095605,Python,75,11,0.92,Python extensions in Rust -- Lessons learned from upgrading a bioinformatics package
t3_ruvaih,1641192079,Python,0,3,0.38,Javascript Vs Python For Web Development
t3_rubjtu,1641136357,Python,6,3,0.71,Why You Should Use Python Data Classes
t3_rtjh63,1641043887,Python,280,15,0.96,Master Dataclasses in Python Part 3 - Ordering of Dataclasses
t3_ruk2j4,1641159413,Python,0,2,0.36,Handy Python Functions
t3_rttq9n,1641074466,Python,25,3,0.92,Space Science with Python - Part 20: Tisserand's Parameter Space
t3_rtu1s1,1641075354,Python,22,3,0.82,One of my favorite videos on concurrency in Python (using Trio)
t3_rtk8gx,1641046553,Python,73,23,0.88,"Web scraping and bypassing ""Activate and hold the button to confirm"""
t3_rtw3k1,1641081170,Python,10,2,0.92,Tool to extract data from Docx files
t3_rucwjm,1641140159,Python,0,1,0.33,Naruto Best Quotes Using Python
t3_rtssjw,1641071859,Python,11,5,0.92,Targe - Authorisation library for python
t3_rtx3rr,1641084088,Python,4,3,0.83,My first usefull code - simple automatique watering system (C&amp;C and improvement welcome)
t3_rtzc3y,1641090825,Python,2,1,0.75,What are the best open source projects where you can intelligently insert objects into pictures?
t3_rt0p1i,1640977072,Python,636,151,0.87,"Guido van Rossum - Python 4.0 will never arrive🤚😔: ""Thеrе will probably nеvеr bе a 4.0 and wе’ll continuе until 3.33, at lеast."" - Sabrina Carpenter [Medium] Then, evidently, we will get a Python 'Pi'"
t3_rtmbj8,1641053353,Python,4,0,0.84,Playing and controlling Atari 2600 Missile command using your hands as motion controls [Project]
t3_rti8of,1641039009,Python,10,7,0.75,Storing Selenium Scraper Progress
t3_rtuqh3,1641077282,Python,1,0,1,SQLAlchemy Core: Where Clause w/Multiple Conjuctions
t3_rtt4cc,1641072777,Python,0,5,0.38,"GitHub - Goldziher/starlite: Light, Flexible and Extensible ASGI API framework"
t3_rsug06,1640959034,Python,280,10,0.97,"About 4 months ago, I showcased a LazyRemote here that allows you to access your PC media controls from a phone. Now, I present to you the next update, Lazy-Remote Mouse which mimics a trackpad and allows you to control your mouse pointer from your phone."
t3_rt3apo,1640984819,Python,72,30,0.94,Developing a Python database ORM with a different philosophy than existing ORMs like SQLAlchemy
t3_ru258w,1641099791,Python,0,1,0.18,How to setup VSCode for Python
t3_rt1xlj,1640980727,Python,42,2,0.9,My latest Python project: a tool for visualising Python Abstract Syntax Trees
t3_rsrgxl,1640948144,Python,86,5,0.93,Coding journey and project ideas for 2022
t3_rt7q3x,1640998538,Python,7,2,0.77,"Building a clock from Quart, socket.io, and React inside a Docker container"
t3_rt0z2j,1640977885,Python,17,0,0.96,Visualization of optimizers on different mathematical functions
t3_rsgyki,1640911396,Python,371,121,0.93,"My 7 yr old little brother has Autism and has been very interested in Python lately, what resources can I give him so he can learn programming completely and properly?"
t3_rt6orx,1640995213,Python,3,0,1,Saturday Daily Thread: Resource Request and Sharing! Daily Thread
t3_rs2utp,1640873951,Python,1353,484,0.94,A strongly typed dialect of Python is coming. I would like to humbly suggest a name for it.
t3_rsl1lc,1640923824,Python,41,9,0.84,Use Signals to Safely Stop processes
t3_rtgo3t,1641032389,Python,0,0,0.1,Creating virtual environments in Python
t3_rt12u0,1640978184,Python,1,9,0.56,PyPrograming Starter
t3_rsim66,1640916314,Python,14,0,0.86,"Edupyter, a new dev env for schools / universities on Windows (no admin rights needed) with Python + Juptyter + Thonny + Console"
t3_rs7vah,1640887253,Python,46,7,0.94,I made Python web app without using any web frameworks
t3_rscgp3,1640899036,Python,22,4,0.93,GitHub - uktrade/stream-zip: Python function to construct a ZIP archive with on the fly - without having to store the entire ZIP in memory or disk
t3_rscmfo,1640899451,Python,20,5,0.83,I built a where to live app using python and PostGIS
t3_rshn4p,1640913483,Python,8,11,1,Feedback Request: Utilities for web scraping
t3_rsaj9t,1640894052,Python,17,0,0.95,Financial Stock Analysis using the Yahoo Finance Python library and Jupyter Notebook
t3_rsg38r,1640908813,Python,4,0,0.84,Friday Daily Thread: Free chat Friday! Daily Thread
t3_rra22x,1640789999,Python,2048,193,0.96,Ever heard of Black? This is the opposite. A tool to turn your clean python code into a hideous (working) mess.
t3_rs6llm,1640884017,Python,13,0,0.93,PID Simulator
t3_rsarqd,1640894660,Python,6,0,0.8,Cat Data Pages - Flask project using TheCatAPI
t3_rs3u2f,1640876715,Python,11,1,0.79,Full-length tutorial on adding automated CI (continuous integration) to your Python projects with GitHub Actions
t3_rrr1id,1640834315,Python,40,11,0.92,The multiprocessing library doesn't work in AWS Lambda functions. So I wrote one that does
t3_rs81ar,1640887661,Python,2,0,0.75,Water Jugs problem
t3_rsagwc,1640893877,Python,1,0,0.56,Understand operator overloading in Python in just 9 minutes.
t3_rs7ysy,1640887486,Python,1,0,0.67,Web api benchmarking: Python (Falcon) vs Rust (Warp)
t3_rs0ff3,1640866400,Python,2,0,0.76,Release announcement: `e2j2`v0.7.1
t3_rrmdyp,1640821330,Python,12,19,0.61,"The Oracle, an open-source Python library to predict the stock market with AI 🤖"
t3_rrwbfq,1640851365,Python,2,1,1,Media pipe finger counter
t3_rr5cs3,1640774571,Python,84,54,0.97,What is the best strategy to align coding practice across the team?
t3_rrjoob,1640814371,Python,12,1,0.85,Tutorial - Generative Art With Python
t3_rrxz59,1640857486,Python,1,4,1,Request for feedback: how can we make it easier to troubleshoot Python applications on Kubernetes?
t3_rrc13l,1640795200,Python,20,2,0.89,"Open source package urllib3 raised $15,000 in 2021"
t3_rs38wi,1640875073,Python,0,0,0.29,Learn how to wish Merry Christmas using Python Turtle Program
t3_rrilbu,1640811635,Python,8,9,0.73,Why is Python relatively slow even compared to some dynamic programming languages?
t3_rrlz4o,1640820237,Python,4,2,0.75,Python Type Hints - How to Handle Optional Imports - Adam Johnson
t3_rqwuhb,1640745232,Python,162,13,0.96,"I made a cli snake game being a begginer, Im so happy:3"
t3_rrl0mr,1640817739,Python,4,0,0.71,My website that allows you to convert an audio/video file to another format. Flask backend.
t3_rr7c7n,1640781713,Python,23,20,0.88,Piou - Build beautiful command-line interfaces with type validation
t3_rrd4yh,1640797998,Python,9,2,0.79,Universalasync – create sync and async libraries at the same time maintaining one codebase
t3_rrdhzq,1640798921,Python,9,0,0.75,"Learn Python ASTs, by building your own linter"
t3_re46xx,1639242936,datascience,317,516,0.97,[Official] 2021 End of Year Salary Sharing thread
t3_ru89hj,1641124831,datascience,3,43,1,Weekly Entering &amp; Transitioning Thread | 02 Jan 2022 - 09 Jan 2022
t3_rv1tpg,1641216817,datascience,177,39,0.97,"Revisiting the ""The Sexiest Job of the 21st Century"" article a decade later: What still remains true and what is no longer true about the industry from the article? And have their speculations bore out?"
t3_rvb2jt,1641241456,datascience,11,2,0.74,The Best Machine Learning Courses on Udemy (2022)
t3_rut3fw,1641184686,datascience,152,70,0.93,"The data science field is very exhausting and consume much of our time, so what else do you do beside your work or study in this domain, that helps you to give your brain a break from it ?"
t3_runqoo,1641169075,datascience,190,25,0.97,Maybe someone looking for a data science job in soccer - AS Roma is looking for a Data Analytics Manager
t3_rv3ep7,1641221560,datascience,9,14,0.8,Advice on Freelancing in DS
t3_rvdra2,1641248473,datascience,2,2,1,"Automated, relevant, business performance insights?"
t3_rvgybs,1641257193,datascience,1,1,0.6,Just learned Command line and Bash....now what?
t3_rv4ppz,1641225073,datascience,4,2,0.75,NLP: Hybridization of statistical approach and expert system ?
t3_rv09mp,1641211640,datascience,6,10,0.76,What are your 2022 goals? And what is your system to reach them?
t3_rvdbu6,1641247372,datascience,1,0,1,Better Method to Predict Frequency/Timing of Payment
t3_rvce7y,1641244916,datascience,0,3,0.5,What should I expect for product case study in the interview?
t3_rvcahp,1641244640,datascience,1,5,0.67,"Graduate in 2023, want to work as a business analyst but haven't learned any DS languages yet"
t3_rvc6yr,1641244377,datascience,0,0,0.33,The Benefits of NLP (Natural Language Processing) In Business Analytics
t3_rv1s9m,1641216706,datascience,4,0,0.83,A good course about DS with Big Data
t3_rvb5nt,1641241678,datascience,1,0,1,Helping Business Analysts Understand Data Science and Machine Learning
t3_ruyogo,1641205662,datascience,5,8,0.78,What's the best Python notebook setup for data analysis?
t3_rvad4n,1641239623,datascience,0,0,0.5,Can you connect PyCharm Community to Microsoft SQL Server?
t3_rva6xp,1641239178,datascience,0,13,0.5,Experienced Data Scientists : On what do you spend your most time on at work?
t3_rv9qt3,1641238011,datascience,1,2,0.6,Report Framework - Trying to move away from Excel for report creation and management
t3_rum01f,1641164444,datascience,40,23,0.83,Is there a lot of writing code in data science?
t3_ruw6x4,1641195558,datascience,7,7,0.77,Has anyone ever dealt with passive-aggressive bullying in the workplace?
t3_rvduvn,1641248730,datascience,0,1,0.25,Data science and personal finance
t3_rvdumf,1641248713,datascience,0,0,0.25,Please advice me
t3_rv8iok,1641234848,datascience,1,3,0.67,"Data Scientists working in healthcare, how do you keep abreast of the latest developments?"
t3_rv8i8s,1641234816,datascience,0,3,0.5,Ideas for relevant data-related tasks I can do in my internship?
t3_rv6qig,1641230241,datascience,1,1,1,I need some guidance - should I do a cert with my MS or something else?
t3_rv5u4i,1641227935,datascience,0,10,0.5,"Project, Tried 6/7 models, all give bad accuracy."
t3_rv2w2p,1641220051,datascience,1,4,0.6,Cracking the DS coding interviews
t3_ruy0xd,1641203061,datascience,2,1,0.75,Can anyone explain about the difference in scope of work between Data Analyst and Market Researcher?
t3_ru4vnt,1641110028,datascience,190,77,0.88,Is medium even proofreading submissions at all?
t3_rv4ils,1641224545,datascience,0,5,0.25,Can I get away with using R Studio to run Python code only? Or will I have to eventually switch to a different platform?
t3_ruol4k,1641171466,datascience,7,3,0.74,Do you use Reinforcement Learning in your work as a data scientist ? How ? What are the applications ?
t3_ruve8z,1641192461,datascience,2,5,0.75,What are the common applications of ML in Fintech companies ?
t3_ruyo93,1641205636,datascience,0,0,0.5,Top 10 Object Detection APIs
t3_ruy59g,1641203574,datascience,0,0,0.33,Reading scala/spark xgboost model in python
t3_ruq3vw,1641175703,datascience,4,2,0.7,What're your favorite tools in 2022? What do you wish someone would build?
t3_rutueh,1641187030,datascience,3,3,0.67,How can I best set myself up for success switching careers to data science?
t3_ruok3r,1641171385,datascience,4,0,0.83,Interrupted Time Series (ITS) in Python
t3_rv4f5l,1641224302,datascience,0,8,0.36,Data science is just numbers in a sausage machine
t3_ruw5gf,1641195388,datascience,0,4,0.33,Planning for Masters in MIS/MSIS master with BA/BI electives
t3_rukocc,1641160958,datascience,4,0,0.84,Better refraction methods?
t3_ruu4qk,1641187977,datascience,1,2,0.67,How to validate data integrity?
t3_ru2l7z,1641101309,datascience,64,35,0.9,From Data Science to Software Engineer (SWE)
t3_run8o2,1641167744,datascience,0,25,0.5,Is Facebook Prophet an awful package that led to Zillow blowing up?
t3_rv0gf5,1641212316,datascience,0,0,0.22,Hey guys!
t3_rujm5v,1641158037,datascience,2,6,0.67,Recommended service for deploying a model online for multiple users to add to a central database
t3_rut7o8,1641185066,datascience,0,4,0.4,Looking to enter the field. Have some questions
t3_rufpw8,1641147763,datascience,1,9,0.55,Is VBA transferable to other languages?
t3_ru5csn,1641112041,datascience,13,6,0.81,Anyone here doing cricket analytics? Could you give some good research papers on how to analyze the games?
t3_rto1f0,1641058413,datascience,184,20,0.88,A (semi-snarky) Request: Write better questions!
t3_runk1l,1641168571,datascience,0,2,0.33,Career advice for transitioning from computer vision to data science ?
t3_rtklxg,1641047846,datascience,80,2,0.94,Interesting 2021 paper roundup from a CMU econ prof. Lots on forecasting!
t3_ru5fgg,1641112368,datascience,1,14,0.67,What is your team function within your organisation?
t3_rtmnb3,1641054355,datascience,10,15,0.82,Intentionally Null cell values
t3_rt4ruy,1640989276,datascience,144,70,0.87,Is this subreddit for data analysts or just data scientists?
t3_rtsp1g,1641071582,datascience,1,4,0.67,Partial Least Squares Regression Question
t3_rt00a8,1640975016,datascience,116,53,0.91,Self worth tied to model performance
t3_rtter0,1641073588,datascience,0,52,0.45,Is it ethically right to pirate a course?
t3_rsfdlx,1640906797,datascience,821,176,0.98,"To the companies that send candidates a 3 hour take-home test, and then say their corporate policy does not permit feedback after one is rejected..."
t3_rtov1g,1641060776,datascience,0,32,0.4,People have been telling me bootcamps are a scam and they out there just to get your money. I also believed college degrees is the only way until colleges everywhere starting to have their own bootcamps. Are they scamming people in doing bootcamps?
t3_rt2mdq,1640982794,datascience,8,11,0.79,How to do data pre-processing in production
t3_rt3tpl,1640986396,datascience,4,24,0.67,How was your graduation project ?
t3_rsza5r,1640972953,datascience,3,3,0.67,Classifying the Political Compass - what method?
t3_rs9ggc,1640891268,datascience,73,30,0.94,How to deal with feature selection?
t3_rsjx9k,1640920268,datascience,8,2,0.9,Nonlinear Programming in R?
t3_rrzswd,1640864182,datascience,133,35,0.96,How do you reduce information leakage and bias when going from descriptive analytics to prescriptive analytics?
t3_rsb6l4,1640895729,datascience,14,23,0.82,Do portfolios matter if you have &gt; 2 years of experience?
t3_rs3dch,1640875417,datascience,35,8,0.84,Interesting read about data storytelling: Why You Need to Tell a Story With Your Data
t3_rsbbjg,1640896090,datascience,9,16,0.84,A graceful exit?
t3_rslgqn,1640925225,datascience,1,14,0.67,Create data lake?
t3_rrlw8y,1640820029,datascience,111,56,0.94,"The more I think of my data career, the more anxious I become (mid career)"
t3_rr7cn2,1640781749,datascience,486,28,0.97,A simple and effective way to go from beginner to intermediate level of ML knowledge
t3_rraolv,1640791663,datascience,197,45,0.95,really feel like Data Science gets romanticized and people don't talk about the support aspect.
t3_rrchxx,1640796400,datascience,81,10,0.98,"The PyMC developers wrote a book! "" Bayesian Modeling and Computation in Python"" Detailed ToC screenshotted, link to publisher's page in first photo"
t3_rrbmaz,1640794125,datascience,31,49,0.94,I made a modern data catalog tool for anyone using a word document or excel sheet as a data catalog. I’m curious if anyone would like to try it out.
t3_rra7t0,1640790396,datascience,29,10,0.91,Friendly reminder to just go ahead and set up git on everything
t3_rrt76h,1640840779,datascience,1,3,0.57,How to find monthly google searches for a specific keyword?
t3_rrfk82,1640804066,datascience,7,8,1,Does anyone know a good resource for making the map in this New York Times article?
t3_rqz1lp,1640751855,datascience,95,88,0.96,"Looking back on what you know now, what concepts took you a surprising amount of effort and time to truly understand?"
t3_rr8i51,1640785440,datascience,11,16,0.87,"Does it make sense doing stats tests (like ttests, chi-square etc) to better select the predictors in a supervised model?"
t3_rqzpl1,1640753988,datascience,39,59,0.85,"What's stopping data scientists from applying to remote-only roles in a high cost of living, high-paying locations like California and living in a low cost of living location?"
t3_rrh6uh,1640808101,datascience,2,4,1,Is Topological Data Analysis useful for time series data?
t3_rr6rtt,1640779797,datascience,7,6,0.89,Transitioning from corporate to Bioinformatics Research
t3_rqysab,1640751054,datascience,12,11,0.8,What is the data science and ML job market like in Australia?
t3_rqdlmi,1640690173,datascience,236,112,0.89,Is Data Science 90% boring and 10% mega-interesting?
t3_rqqxwk,1640728933,datascience,16,8,0.85,Soft Skills/ Calm down a unhappy client
t3_rqhe0k,1640702645,datascience,30,7,0.89,What kind of analysis I should conduct to see impact from multivariate time-series data?
t3_rqy5te,1640749157,datascience,0,2,0.44,"Which data science/ML development processes would you like to see more automated (i.e., have a Python library for)?"
t3_rq0y5g,1640649044,datascience,121,73,0.94,Is decision science really a thing? Or is it more marketing buzz?
t3_rqm2pb,1640715646,datascience,5,21,0.63,Graphics for data?
t3_rqnz3n,1640720882,datascience,1,0,1,Help using Metaknowledge for bibliometric analysis
t3_rprvb4,1640624476,datascience,134,29,0.97,Books on Model Deployment
t3_rq3p2g,1640657014,datascience,22,8,0.86,"What's the deal with ""manual entry"" job applications?"
t3_rqd7ep,1640688608,datascience,2,2,0.63,legalities of collection and Redistribution of information from APIs or web scraping.
t3_rq7jam,1640668272,datascience,10,4,0.75,This paper is a little over my head but I am excited about quantifying non-monotonic associations between variables. What's your take?
t3_rqin2x,1640706211,datascience,1,0,0.67,Search: interesting topic in data quality assessment
t3_rqfxhd,1640698226,datascience,1,2,0.56,Best websites (paid) for historical tick data for Equities/ETFs/Indices
t3_rozxuk,1640535235,datascience,1892,67,0.96,What Companies think AI looks like vs What Actually it is
t3_rpvvh5,1640635202,datascience,6,0,0.69,COVID case data and US airline travel data together in a panel regression. 😱🦠
t3_rplch6,1640603807,datascience,13,19,0.88,Model agnostic feature importance
t3_rvb96k,1641241921,SQL,4,3,0.76,Help with a Join
t3_rv06sa,1641211362,SQL,18,4,0.95,help with SQL query
t3_rv1n3i,1641216250,SQL,9,7,0.92,When would one want to use a composite key rather than a surrogate key?
t3_rv317a,1641220461,SQL,5,3,0.74,Removing pure integers from values
t3_ruz4ze,1641207470,SQL,10,26,0.92,Is it recommended to change the data type of a column from varchar to int if possible eventhough varchar would be more intuitive? Would there be a benefit in terms of speed that is worth it?
t3_rvebje,1641249946,SQL,1,0,1,Help with Terminal
t3_rvdr3e,1641248459,SQL,0,2,0.5,Subqueries : learning path
t3_rvcaqq,1641244659,SQL,1,2,1,Grouping by one column but counting values in another
t3_rvbm2a,1641242871,SQL,1,0,1,XAMPP - cannot start mysql on Mac
t3_rv9uvy,1641238309,SQL,1,2,1,"SQL Query date range shows current year. With 2022 just beginning, how do I adjust the query so that it automatically shows Q4 of the prior year only in the case that it is currently Q1?"
t3_rukrz6,1641161236,SQL,33,23,0.96,"I finished SQLbolt and after trying some problems on HackerRank, I notice some answers use REGEXP but I haven't learned that yet. What resource should I use next to learn the ""next level"" of SQL?"
t3_rv4v3u,1641225482,SQL,1,3,1,Getting start time from a datetime range in SQL Server
t3_rv2vjv,1641220003,SQL,1,3,0.67,Help with Interview Question
t3_ruyuwm,1641206376,SQL,2,1,1,Some intermediate project ideas that can use sql as database
t3_rus6do,1641181829,SQL,7,8,0.83,"Beginner/intermediate: how to actually answer ""practical"" questions?"
t3_ruqymq,1641178135,SQL,6,4,0.81,SQL Query Help Needed
t3_ruxi2k,1641200914,SQL,2,2,0.75,Beginner Unsure of How to Structure Database
t3_ruqg1e,1641176640,SQL,7,0,0.83,Updated PostgreSQL and Pgadmin - I can no longer dump my file
t3_rukvku,1641161495,SQL,11,13,0.87,How would you approach a DB that has no ERD available for review
t3_rujj8a,1641157835,SQL,3,25,0.72,Is there really no way to restore an individual table?
t3_ru7ild,1641121511,SQL,14,0,0.84,Importing Large SQL File in MySQL Database
t3_ruae10,1641132703,SQL,4,10,0.84,"Need SQL Statement Help, Please!"
t3_ru2efi,1641100666,SQL,10,24,0.86,What is best SQL editor ?
t3_ruars3,1641133953,SQL,1,20,0.53,Are there any jobs available for someone with python and SQL(as well as certifications in other disciplines)???
t3_rtn9lf,1641056205,SQL,51,22,0.95,What career paths can I go down after learning SQL? I understand I have to learn other tools so I'm trying to figure out what else to learn depending on the career path
t3_rtuq4t,1641077255,SQL,16,8,0.85,How to Approach SQL questions in Interview
t3_ru03bl,1641093186,SQL,3,15,0.81,Newbie - Should I break this into multiple tables?
t3_ru1ubm,1641098774,SQL,1,5,0.56,How to find a job that uses mainly SQL ?
t3_rton57,1641060137,SQL,13,13,1,Need help writing an SQL statement
t3_rtse7p,1641070761,SQL,6,5,0.88,"Need advice, trying to jump start career in SQL"
t3_rti83n,1641038944,SQL,24,11,0.95,How do I progress with SQL?
t3_ru1bgy,1641097044,SQL,1,18,0.6,MS SQL Server and Python
t3_rtq7hg,1641064597,SQL,2,0,1,SQL language proposal: JOIN FOREIGN
t3_rtdxxr,1641020760,SQL,9,39,1,Swap columns with a condition
t3_rt3d9a,1640985035,SQL,8,13,0.84,How would you model a file tree?
t3_rsrav0,1640947445,SQL,51,45,0.84,"Gave myself a week to learn SQL and complete and assignment, it is not going well"
t3_rsrbvr,1640947569,SQL,5,13,0.74,How to structure a DB with many identical dates ?
t3_rsck39,1640899285,SQL,25,37,0.91,Job Options
t3_rslds3,1640924962,SQL,5,3,0.74,To the CLOUD!! Best strategy?
t3_rsja4i,1640918305,SQL,3,16,0.81,PostgreSQL query to SQL
t3_rsntd1,1640933522,SQL,1,2,0.67,SQL CodeSignal Assessment Tips/Help?!
t3_rsavsu,1640894966,SQL,2,8,0.61,Alphanumeric Sort with Numbers and Letters
t3_rru1re,1640843480,SQL,26,29,0.9,Using SQL as a life database?
t3_rrybeg,1640858740,SQL,5,10,0.74,Complicated calculations - should be done on query or locally?
t3_rs6asx,1640883276,SQL,0,5,0.5,Woah a Motherload of Questions :)
